{
  "$schema": "./labpilot.normwerte.schema.json",
  "source": "Institut für medizinische und pharmazeutische Prüfungsfragen (IMPP), Mainz – Laborparameter-Tabellen mit Referenzbereichen für Erwachsene und Kinder",
  "disclaimer": "Referenzbereiche dienen Lern- und Übungszwecken. Keine Verwendung für reale Patientenbefunde. Werte können je nach Labor und Methode abweichen.",
  "categories": {
    "saeure_basen": "Säure-Basen-Status",
    "haematologie": "Hämatologie",
    "gerinnung": "Gerinnung",
    "klinische_chemie": "Klinische Chemie",
    "endokrinologie": "Endokrinologie / Hormone",
    "tumormarker": "Tumormarker",
    "vitamine": "Vitamine",
    "elektrolyte": "Elektrolyte",
    "lipide": "Lipidstoffwechsel",
    "leberwerte": "Leber-/Pankreaswerte",
    "nierenwerte": "Nierenwerte",
    "urin": "Urin"
  },
  "values": [

    {
      "id": "be_adult",
      "label": "Base Excess (BE)",
      "value": "-2 bis +3 mmol/l",
      "bereich": "chemie",
      "category": "saeure_basen",
      "specimen": "arteriell",
      "age_group": "adult",
      "si_value": "-2 bis +3 mmol/L"
    },
    {
      "id": "ph_adult",
      "label": "pH (arteriell)",
      "value": "7.35-7.45",
      "bereich": "chemie",
      "category": "saeure_basen",
      "specimen": "arteriell",
      "age_group": "adult"
    },
    {
      "id": "pco2_adult",
      "label": "pCO2",
      "value": "32-45 mmHg",
      "bereich": "chemie",
      "category": "saeure_basen",
      "specimen": "arteriell",
      "age_group": "adult",
      "si_value": "4.3-6.0 kPa",
      "conventional_value": "32-45 mmHg"
    },
    {
      "id": "po2_adult",
      "label": "pO2",
      "value": "65-100 mmHg",
      "bereich": "chemie",
      "category": "saeure_basen",
      "specimen": "arteriell",
      "age_group": "adult",
      "si_value": "8.7-13.3 kPa",
      "conventional_value": "65-100 mmHg"
    },
    {
      "id": "stdbic_adult",
      "label": "Standardbikarbonat",
      "value": "22-26 mmol/l",
      "bereich": "chemie",
      "category": "saeure_basen",
      "specimen": "arteriell",
      "age_group": "adult"
    },

    {
      "id": "bsg_f",
      "label": "BSG nach Westergren – Frauen",
      "value": "< 20 mm / 1 h",
      "bereich": "haema",
      "category": "haematologie",
      "sex": "f",
      "age_group": "adult",
      "note": "Blutkörperchensenkungsgeschwindigkeit"
    },
    {
      "id": "bsg_m",
      "label": "BSG nach Westergren – Männer",
      "value": "< 15 mm / 1 h",
      "bereich": "haema",
      "category": "haematologie",
      "sex": "m",
      "age_group": "adult"
    },
    {
      "id": "leuko_adult",
      "label": "Leukozyten",
      "value": "4 000-10 000 /µl",
      "bereich": "haema",
      "category": "haematologie",
      "age_group": "adult"
    },
    {
      "id": "leuko_myelo",
      "label": "Leukozyten – Myelozyten/Metamyelozyten",
      "value": "0-1 %",
      "bereich": "haema",
      "category": "haematologie",
      "age_group": "adult",
      "parent_id": "leuko_adult"
    },
    {
      "id": "leuko_stab",
      "label": "Leukozyten – Stabkernige",
      "value": "150-400 /µl (3-5 %)",
      "bereich": "haema",
      "category": "haematologie",
      "age_group": "adult",
      "parent_id": "leuko_adult"
    },
    {
      "id": "leuko_seg",
      "label": "Leukozyten – Segmentkernige",
      "value": "3 000-5 800 /µl (50-70 %)",
      "bereich": "haema",
      "category": "haematologie",
      "age_group": "adult",
      "parent_id": "leuko_adult"
    },
    {
      "id": "leuko_eos",
      "label": "Leukozyten – Eosinophile",
      "value": "50-250 /µl (1-4 %)",
      "bereich": "haema",
      "category": "haematologie",
      "age_group": "adult",
      "parent_id": "leuko_adult"
    },
    {
      "id": "leuko_baso",
      "label": "Leukozyten – Basophile",
      "value": "15-50 /µl (0-1 %)",
      "bereich": "haema",
      "category": "haematologie",
      "age_group": "adult",
      "parent_id": "leuko_adult"
    },
    {
      "id": "leuko_lympho",
      "label": "Leukozyten – Lymphozyten",
      "value": "1 500-3 000 /µl (25-45 %)",
      "bereich": "haema",
      "category": "haematologie",
      "age_group": "adult",
      "parent_id": "leuko_adult"
    },
    {
      "id": "leuko_mono",
      "label": "Leukozyten – Monozyten",
      "value": "285-500 /µl (3-7 %)",
      "bereich": "haema",
      "category": "haematologie",
      "age_group": "adult",
      "parent_id": "leuko_adult"
    },
    {
      "id": "thrombo_adult",
      "label": "Thrombozyten",
      "value": "150-400 /nl",
      "bereich": "haema",
      "category": "haematologie",
      "age_group": "adult"
    },
    {
      "id": "ery_f",
      "label": "Erythrozyten – Frauen",
      "value": "3.5-5.0 /pl",
      "bereich": "haema",
      "category": "haematologie",
      "sex": "f",
      "age_group": "adult"
    },
    {
      "id": "ery_m",
      "label": "Erythrozyten – Männer",
      "value": "4.3-5.9 /pl",
      "bereich": "haema",
      "category": "haematologie",
      "sex": "m",
      "age_group": "adult"
    },
    {
      "id": "retikulozyten_adult",
      "label": "Retikulozyten",
      "value": "0.5-2.0 %",
      "bereich": "haema",
      "category": "haematologie",
      "age_group": "adult"
    },
    {
      "id": "mcv_adult",
      "label": "MCV",
      "value": "81-100 fl",
      "bereich": "haema",
      "category": "haematologie",
      "age_group": "adult"
    },
    {
      "id": "mch_adult",
      "label": "MCH",
      "value": "27-34 pg",
      "bereich": "haema",
      "category": "haematologie",
      "age_group": "adult",
      "si_value": "1.67-2.11 fmol",
      "conventional_value": "27-34 pg"
    },
    {
      "id": "mchc_adult",
      "label": "MCHC",
      "value": "320-360 g/l",
      "bereich": "haema",
      "category": "haematologie",
      "age_group": "adult",
      "si_value": "19.85-22.34 mmol/l",
      "conventional_value": "320-360 g/l"
    },
    {
      "id": "hb_f_adult",
      "label": "Hämoglobin – Frauen",
      "value": "120-150 g/l",
      "bereich": "haema",
      "category": "haematologie",
      "sex": "f",
      "age_group": "adult",
      "si_value": "7.45-9.31 mmol/l",
      "conventional_value": "120-150 g/l"
    },
    {
      "id": "hb_m_adult",
      "label": "Hämoglobin – Männer",
      "value": "136-172 g/l",
      "bereich": "haema",
      "category": "haematologie",
      "sex": "m",
      "age_group": "adult",
      "si_value": "8.44-10.68 mmol/l",
      "conventional_value": "136-172 g/l"
    },
    {
      "id": "hba1c_adult",
      "label": "HbA1c",
      "value": "4-6 %",
      "bereich": "haema",
      "category": "haematologie",
      "age_group": "adult",
      "si_value": "20-42 mmol/mol",
      "conventional_value": "4-6 %"
    },
    {
      "id": "hkt_f",
      "label": "Hämatokrit – Frauen",
      "value": "0.33-0.43",
      "bereich": "haema",
      "category": "haematologie",
      "sex": "f",
      "age_group": "adult"
    },
    {
      "id": "hkt_m",
      "label": "Hämatokrit – Männer",
      "value": "0.39-0.49",
      "bereich": "haema",
      "category": "haematologie",
      "sex": "m",
      "age_group": "adult"
    },

    {
      "id": "tpz_adult",
      "label": "Thromboplastinzeit (TPZ; Quick)",
      "value": "70-130 %",
      "bereich": "chemie",
      "category": "gerinnung",
      "specimen": "Plasma",
      "age_group": "adult"
    },
    {
      "id": "aptt_adult",
      "label": "aktivierte partielle Thromboplastinzeit (aPTT)",
      "value": "26-36 s",
      "bereich": "chemie",
      "category": "gerinnung",
      "specimen": "Plasma",
      "age_group": "adult"
    },
    {
      "id": "ptz_adult",
      "label": "Plasma-Thrombinzeit (PTZ)",
      "value": "17-24 s",
      "bereich": "chemie",
      "category": "gerinnung",
      "specimen": "Plasma",
      "age_group": "adult"
    },
    {
      "id": "fibrinogen_adult",
      "label": "Fibrinogen",
      "value": "1.8-3.5 g/l",
      "bereich": "chemie",
      "category": "gerinnung",
      "specimen": "Plasma",
      "age_group": "adult",
      "si_value": "4.4-10.3 µmol/l",
      "conventional_value": "1.8-3.5 g/l"
    },
    {
      "id": "at3_adult",
      "label": "Antithrombin III",
      "value": "0.14-0.39 g/l",
      "bereich": "chemie",
      "category": "gerinnung",
      "specimen": "Plasma",
      "age_group": "adult"
    },
    {
      "id": "ddimere_adult",
      "label": "D-Dimere",
      "value": "< 0.5 mg/l",
      "bereich": "chemie",
      "category": "gerinnung",
      "specimen": "Plasma",
      "age_group": "adult"
    },

    {
      "id": "alt_f",
      "label": "ALT (GPT) – Frauen",
      "value": "≤ 35 U/l",
      "bereich": "chemie",
      "category": "leberwerte",
      "specimen": "Serum",
      "sex": "f",
      "age_group": "adult",
      "si_value": "≤ 0.58 µkat/l",
      "conventional_value": "≤ 35 U/l"
    },
    {
      "id": "alt_m",
      "label": "ALT (GPT) – Männer",
      "value": "≤ 45 U/l",
      "bereich": "chemie",
      "category": "leberwerte",
      "specimen": "Serum",
      "sex": "m",
      "age_group": "adult",
      "si_value": "≤ 0.75 µkat/l",
      "conventional_value": "≤ 45 U/l"
    },
    {
      "id": "albumin_adult",
      "label": "Albumin",
      "value": "35-50 g/l",
      "bereich": "chemie",
      "category": "klinische_chemie",
      "specimen": "Serum",
      "age_group": "adult"
    },
    {
      "id": "amylase_adult",
      "label": "α-Amylase",
      "value": "≤ 100 U/l",
      "bereich": "chemie",
      "category": "klinische_chemie",
      "specimen": "Serum",
      "age_group": "adult",
      "si_value": "≤ 1.67 µkat/l"
    },
    {
      "id": "asl_adult",
      "label": "Antistreptolysintiter (ASL)",
      "value": "≤ 200 IU/ml",
      "bereich": "chemie",
      "category": "klinische_chemie",
      "specimen": "Serum",
      "age_group": "adult"
    },
    {
      "id": "ast_f",